{"schema_version":"1.0","task_id":"TASK-0001","goal":"Define contracts","repository_id":"123e4567-e89b-42d3-a456-426614174000","branch":"main","base_commit":"1111111111111111111111111111111111111111","subject_commit":null,"worktree_dirty":true,"allowed_scope":[".ai/schemas/**"],"forbidden_actions":["push"],"current_state":"NEW","created_at":"2026-08-20T05:00:00Z","updated_at":"2026-08-20T05:00:00Z","decision_units":[{"schema_version":"1.0","task_id":"TASK-0001","decision_unit_id":"DU-001","goal":"Define task schema","inputs":["MVP design"],"planned_actions":["create schema"],"impact_scope":[".ai/schemas/task.schema.json"],"reversibility":"reversible","verification_methods":["pytest"],"external_side_effects":[],"permission_requirements":[]}],"repository_path_at_creation":"D:\\Repos\\harness-model"}
